{
  "$schema": "https://json-schema.org/draft/2020-12/schema",
  "$id": "https://ryoko.invalid/contracts/PlaceCardResponse.schema.json",
  "title": "PlaceCardResponse",
  "type": "object",
  "required": [
    "language",
    "phrases",
    "tips",
    "generatedAt"
  ],
  "properties": {
    "language": {
      "type": "string",
      "pattern": "^[a-z]{2,3}(-[A-Za-z0-9]{2,8})*$",
      "description": "BCP-47 language tag, e.g. en, ja, zh-Hans"
    },
    "phrases": {
      "type": "array",
      "items": {
        "type": "object",
        "required": [
          "id",
          "lang",
          "local",
          "romanization",
          "gloss",
          "because",
          "basis"
        ],
        "properties": {
          "id": {
            "type": "string",
            "minLength": 1,
            "maxLength": 64
          },
          "lang": {
            "type": "string",
            "pattern": "^[a-z]{2,3}(-[A-Za-z0-9]{2,8})*$",
            "description": "BCP-47 language tag, e.g. en, ja, zh-Hans"
          },
          "local": {
            "type": "string",
            "minLength": 1,
            "maxLength": 200,
            "description": "The phrase in local script"
          },
          "romanization": {
            "anyOf": [
              {
                "type": "string",
                "minLength": 1,
                "maxLength": 300,
                "description": "Pinyin or romaji; null for Latin-script languages"
              },
              {
                "type": "null"
              }
            ]
          },
          "gloss": {
            "type": "string",
            "minLength": 1,
            "maxLength": 200,
            "description": "Meaning in the home language"
          },
          "because": {
            "type": "string",
            "minLength": 1,
            "maxLength": 80,
            "description": "About 8–10 words, in the home language"
          },
          "basis": {
            "type": "array",
            "items": {
              "type": "string",
              "enum": [
                "place",
                "localTime",
                "personality",
                "nationality",
                "diet",
                "allergy",
                "favourites",
                "taste",
                "memory"
              ]
            },
            "minItems": 1,
            "maxItems": 2,
            "uniqueItems": true
          }
        },
        "additionalProperties": false
      },
      "minItems": 2,
      "maxItems": 3
    },
    "tips": {
      "type": "array",
      "items": {
        "type": "object",
        "required": [
          "text",
          "basis"
        ],
        "properties": {
          "text": {
            "type": "string",
            "minLength": 1,
            "maxLength": 200,
            "description": "In the home language"
          },
          "basis": {
            "type": "array",
            "items": {
              "type": "string",
              "enum": [
                "place",
                "localTime",
                "personality",
                "nationality",
                "diet",
                "allergy",
                "favourites",
                "taste",
                "memory"
              ]
            },
            "minItems": 1,
            "maxItems": 2,
            "uniqueItems": true
          },
          "source": {
            "type": "object",
            "required": [
              "title",
              "url"
            ],
            "properties": {
              "title": {
                "type": "string",
                "minLength": 1,
                "maxLength": 200
              },
              "url": {
                "type": "string",
                "format": "uri",
                "pattern": "^https?://"
              }
            },
            "additionalProperties": false
          }
        },
        "additionalProperties": false
      },
      "minItems": 1,
      "maxItems": 2
    },
    "placeNameLocal": {
      "type": "string",
      "minLength": 1,
      "maxLength": 120
    },
    "addressLocal": {
      "type": "string",
      "minLength": 1,
      "maxLength": 240
    },
    "generatedAt": {
      "type": "string",
      "format": "date-time"
    }
  },
  "additionalProperties": false
}
